Data;Modalidade;Cidade;Órgão;Natureza;Função;Categoria_Final;Objeto;Valor;Link;Status_Duplicidade
2026-01-15;Dispensa;São Rafael;MUNICIPIO DE SAO RAFAEL;AQUISIÇÃO;OUTROS;AQUISIÇÃO - OUTROS;Aquisição de gás de cozinha (GLP), destinado a atender às necessidades de uso e ao pleno funcionamento das repartições públicas das Secretarias do Município.;65361.56;;ORIGINAL
2026-01-15;Dispensa;Santana do Seridó;MUNICIPIO DE SANTANA DO SERIDO;AQUISIÇÃO;OUTROS;AQUISIÇÃO - OUTROS;Aquisição de fardamentos específicos, destinados a atender as demandas da Secretaria Municipal de Educação e Cultura.;31714.44;;ORIGINAL
2026-01-15;Pregão;Açu;MUNICIPIO DE ASSU;AQUISIÇÃO;OUTROS;AQUISIÇÃO - OUTROS;[Portal de Compras Públicas] - Registro de Preços para futura e eventual contratação de empresa para aquisição e instalação de sinalização de trânsito horizontal e vertical no município de Assu/RN, conforme condições, quantidades e exigências estabelecidas neste Edital e seus anexos;2800115.0;https://portaldecompraspublicas.com.br/processos/RN/Prefeitura-Municipal-de-Assu-1270/RPE-036-2025-2026-450001;ORIGINAL
2026-01-15;Pregão;Brejinho;MUNICIPIO DE BREJINHO;AQUISIÇÃO;OUTROS;AQUISIÇÃO - OUTROS;[Portal de Compras Públicas] - REGISTRO DE PREÇOS PARA AQUISIÇÃO DE EQUIPAMENTOS E MATERIAIS PERMANENTES PARA ATENDER AS NECESSIDADES DA SECRETARIA MUNICIPAL DE SAÚDE DE BREJINHO/RN;0.0;https://portaldecompraspublicas.com.br/processos/RN/Prefeitura-Municipal-de-Brejinho-1150/RPE-PE-01-2026-2026-449734;ORIGINAL
2026-01-15;Pregão;Martins;MUNICIPIO DE MARTINS;SERVIÇOS;OUTROS;SERVIÇOS - OUTROS;Referência consiste no Registro de Preços para a eventual aquisição de fardamentos e Equipamentos de Proteção Individual – EPIs destinados aos garis e demais agentes de limpeza do Município de Martins/RN.;163499.3;;ORIGINAL
2026-01-15;Dispensa;Mossoró;MUNICIPIO DE MOSSORO;AQUISIÇÃO;OUTROS;AQUISIÇÃO - OUTROS;[Portal de Compras Públicas] - Aquisição de materiais, destinado a prevenção e o combate a incêndios nas dependências do Ginásio de Esporte Engº Pedro Ciarlini Neto.;16930.14;https://portaldecompraspublicas.com.br/processos/RN/Prefeitura-Municipal-de-Mossoro-1230/DE-01-2026-2026-450047;ORIGINAL
2026-01-15;Dispensa;Sítio Novo;SITIO NOVO CAMARA MUNICIPAL;SERVIÇOS;OUTROS;SERVIÇOS - OUTROS;Contratação de empresa para prestação de serviços de assessoria em transparência pública, visando atender aos critérios do radar da transparência pública do tribunal de contas do estado do Rio Grande do Norte – TCE/RN e da Atricon, abrangendo: identificação e correção de lacunas de informações, notificação e apoio aos setores competentes para inclusão de dados, acompanhamento e evolução contínua do sistema de transparência pública, padronização e atualização contínua das informações disponibilizadas no portal da transparência, bem como implantação e manutenção de plataforma tecnológica que facilite a participação cidadã, otimize os mecanismos de fiscalização dos órgãos de controle e assegure suporte à prestação de contas do poder legislativo;64325.64;;ORIGINAL
2026-01-15;Dispensa;Santana do Matos;SANTANA DO MATOS CAMARA MUNICIPAL;AQUISIÇÃO;OUTROS;AQUISIÇÃO - OUTROS;Contratação de empresa para prestação de serviços técnicos de operação dos sistemas e sonorização, produção e gravação de imagens, vídeos e áudios, distribuição do material gravado compatível com as mídias digitais existentes no mercado local durante as sessões da Câmara Municipal de Santana do Matos/RN;36343.44;https://transparencia.agilirn.com.br/camsantanamatos-rn/licitacoes/licitacao?id=196;ORIGINAL
2026-01-15;Dispensa;São Rafael;MUNICIPIO DE SAO RAFAEL;AQUISIÇÃO;OUTROS;AQUISIÇÃO - OUTROS;Contratação de Serviço de hospedagem para atender as demandas do município de São Rafael/RN.;40276.5;;ORIGINAL
2026-01-15;Dispensa;Martins;MUNICIPIO DE MARTINS;AQUISIÇÃO;OUTROS;AQUISIÇÃO - OUTROS;Aquisição de mochilas confeccionadas em nylon, destinadas à distribuição aos professores da rede municipal de educação do municipio de Martins-RN, durante a jornada pedagógica do ano letivo de 2026, conforme especificações técnicas descritas.;23138.0;;ORIGINAL
2026-01-15;Dispensa;São Rafael;MUNICIPIO DE SAO RAFAEL;AQUISIÇÃO;OUTROS;AQUISIÇÃO - OUTROS;Contratação do serviço de fornecimento de refeições prontas para atender a demanda do município de São Rafael/RN;19508.5;;ORIGINAL
2026-01-15;Pregão;Carnaubais;MUNICIPIO DE CARNAUBAIS;AQUISIÇÃO;OUTROS;AQUISIÇÃO - OUTROS;[Portal de Compras Públicas] - AQUISIÇÃO DE UM VEÍCULO AUTOMOTOR NOVO, TIPO VAN, PARA COMPOR E RENOVAR A FROTA DA SECRETARIA MUNICIPAL DE SAÚDE DE CARNAUBAIS/RN.;367142.86;https://portaldecompraspublicas.com.br/processos/RN/Prefeitura-Municipal-de-Carnaubais-1631/PE-PE-004-2026-2026-450012;ORIGINAL
2026-01-15;Pregão;Jucurutu;MUNICIPIO DE JUCURUTU;AQUISIÇÃO;OUTROS;AQUISIÇÃO - OUTROS;Registro de preços para aquisição de recarga de gás oxigênio medicinal, válvulas reguladoras para cilindros de oxigênio com fluxômetro e umidificador para oxigênio.;0.0;;ORIGINAL
2026-01-16;Dispensa;Martins;MUNICIPIO DE MARTINS;AQUISIÇÃO;OUTROS;AQUISIÇÃO - OUTROS;Contratação de empresa especializada para a locação de software de controle de frequência (ponto eletrônico), com tecnologia de validação biométrica facial e geolocalização, destinado ao registro, gerenciamento e acompanhamento da jornada de trabalho dos servidores, conforme especificações técnicas, requisitos funcionais e condições estabelecidas no Termo de Referência conforme condições, quantidades, exigências e estimativas contidas neste Termo de Referência.;18300.0;;ORIGINAL
2026-01-16;Pregão;Natal;RIO GRANDE DO NORTE SECRETARIA DA ADMINISTRACAO;AQUISIÇÃO;OUTROS;AQUISIÇÃO - OUTROS;Aquisição de Equipamentos e Soluções de Tecnologia, incluindo fornecimento, instalação, configuração, licenças e treinamento, para a modernização integral do Controlador Central e dos subsistemas que compõem o sistema de radiocomunicação digital (Padrão APCO25).;7000000.0;https://cnetmobile.estaleiro.serpro.gov.br/comprasnet-web/public/landing?destino=acompanhamento-compra&compra=92553805901632025;ORIGINAL
2026-01-16;Pregão;Natal;UNIVERSIDADE FEDERAL DO RIO GRANDE DO NORTE;AQUISIÇÃO;OUTROS;AQUISIÇÃO - OUTROS;Pregão Eletrônico SISRP Nº.: 90007/2025 - Aquisição de equipamentos de processamento de dados (solução não tic) para atender demandas da UFRN pelo período de 12 (doze) meses.;1965368.6;https://cnetmobile.estaleiro.serpro.gov.br/comprasnet-web/public/landing?destino=acompanhamento-compra&compra=15310305900072025;ORIGINAL
2026-01-16;Pregão;São José do Seridó;MUNICIPIO DE SAO JOSE DO SERIDO;AQUISIÇÃO;OUTROS;AQUISIÇÃO - OUTROS;[Portal de Compras Públicas] - REGISTRO DE PREÇOS PARA POSSÍVEL CONTRATAÇÃO GRADATIVA DE EMPRESA ESPECIALIZADA NA INSTALAÇÃO E MANUTENÇÃO DE EQUIPAMENTOS DE REFRIGERAÇÃO.;164920.0;https://portaldecompraspublicas.com.br/processos/RN/Prefeitura-Municipal-de-Sao-Jose-do-Serido-1054/PE-002-2026-2026-449835;ORIGINAL
2026-01-16;Pregão;São José do Seridó;MUNICIPIO DE SAO JOSE DO SERIDO;AQUISIÇÃO;OUTROS;AQUISIÇÃO - OUTROS;CONTRATAÇÃO DE EMPRESA ESPECIALIZADA NA INSTALAÇÃO E MANUTENÇÃO DE EQUIPAMENTOS DE REFRIGERAÇÃO.;164920.0;;ORIGINAL
2026-01-16;Dispensa;Jardim de Piranhas;MUNICIPIO DE JARDIM DE PIRANHAS;AQUISIÇÃO;OUTROS;AQUISIÇÃO - OUTROS;CONTRATAÇÃO DE EMPRESA ESPECIALIZADA PARA ORGANIZAÇÃO DA JORNADA PEDAGÓGICA E SEMINÁRIO DE EDUCAÇÃO NO ANO DE 2026, ATENDENDO AS NECESSIDADES DA SECRETARIA MUNICIPAL DE EDUCAÇÃO DO MUNICÍPIO DE JARDIM DE PIRANHAS-RN;65232.64;;ORIGINAL
2026-01-16;Dispensa;Jardim de Piranhas;MUNICIPIO DE JARDIM DE PIRANHAS;OBRAS;OUTROS;OBRAS - OUTROS;CONTRATAÇÃO DE EMPRESA ESPECIALIZADA NA PRESTAÇÃO DE SERVIÇOS DE ENGENHARIA PARA ELABORAÇÃO DE PROJETOS COMPLEMENTARES E ORÇAMENTO DE OBRAS PÚBLICAS REALIZADAS COM RECURSOS PRÓPRIOS DO MUNICÍPIO OU ATRAVÉS DE CONVÊNIOS FIRMADOS ENTRE ESTA MUNICIPALIDADE E GOVERNO FEDERAL;50799.96;;ORIGINAL
2026-01-16;Dispensa;Parelhas;MUNICIPIO DE PARELHAS;AQUISIÇÃO;SAÚDE - MEDICAMENTOS;AQUISIÇÃO - SAÚDE - MEDICAMENTOS;[Portal de Compras Públicas] - Aquisição de medicamentos por ordem judicial;13534.08;https://portaldecompraspublicas.com.br/processos/RN/Prefeitura-Municipal-de-Parelhas-1046/DE-35-2025-2026-449594;ORIGINAL
2026-01-16;Dispensa;Parelhas;MUNICIPIO DE PARELHAS;AQUISIÇÃO;OUTROS;AQUISIÇÃO - OUTROS;[Portal de Compras Públicas] - AQUISIÇÃO DE FRALDAS DESCARTÁVEIS POR ORDEM JUDICIAL;12650.4;https://portaldecompraspublicas.com.br/processos/RN/Prefeitura-Municipal-de-Parelhas-1046/DE-33-2026-2026-449630;ORIGINAL
2026-01-16;Pregão;Tibau do Sul;MUNICIPIO DE TIBAU DO SUL;AQUISIÇÃO;OUTROS;AQUISIÇÃO - OUTROS;[Portal de Compras Públicas] - REGISTRO DE PREÇOS PARA EVENTUAL E FUTURA CONTRATAÇÃO DE EMPRESA PARA PRESTAÇÃO DE SERVIÇOS GRÁFICOS, A FIM DE ATENDER AS DEMANDAS DA PREFEITURA DE TIBAU DO SUL/RN.;0.0;https://portaldecompraspublicas.com.br/processos/RN/Prefeitura-Municipal-de-Tibau-do-Sul-1121/RPE-38-2025-2026-450145;ORIGINAL
2026-01-16;Dispensa;Januário Cicco;MUNICIPIO DE BOA SAUDE;SERVIÇOS;OUTROS;SERVIÇOS - OUTROS;Contratação de empresa especializada na prestação de serviços de assessoria de apoio administrativo, com ênfase na assistência técnica, regularização de pendências, monitoramento e acompanhamento nos sistemas do Ministério da Educação (SIMEC) e do Fundo Nacional de Desenvolvimento da Educação (FNDE), visando atender às necessidades da Secretaria Municipal de Educação de Boa Saúde/RN;59799.96;;ORIGINAL
2026-01-16;Pregão;São Gonçalo do Amarante;SERVICO AUTONOMO DE AGUA E ESGOTO;AQUISIÇÃO;OUTROS;AQUISIÇÃO - OUTROS;[Portal de Compras Públicas] - Contratação de empresa especializada para aquisição de bebedouro elétrico, incluindo componentes e acessórios (torneira, filtro, purificador e refis), destinados ao atendimento das necessidades do Serviço Autônomo de Água e Esgoto de São Gonçalo do Amarante – SAAE/SGA.;18456.46;https://portaldecompraspublicas.com.br/processos/RN/Servico-Autonomo-de-Agua-e-Esgoto-de-Sao-Goncalo-do-Amarante-1431/RPE-PE-0471-2025-2026-450153;ORIGINAL
2026-01-16;Dispensa;Natal;MUNICIPIO DE NATAL;AQUISIÇÃO;OUTROS;AQUISIÇÃO - OUTROS;Contratação de empresa especializada na locação de tablet com serviços de internet, visando suprir as necessidades do Departamento de Concessões, Permissões e Autorização - DCPA/SEMSUR, conforme as especificações deste Termo de Referência.;46366.32;http://portaldecomprasnatal.com.br;ORIGINAL
2026-01-16;Pregão;Januário Cicco;MUNICIPIO DE BOA SAUDE;SERVIÇOS;OUTROS;SERVIÇOS - OUTROS;FORMAÇÃO DE REGISTRO DE PREÇOS PARA FUTURA CONTRATAÇÃO DE EMPRESA PARA AQUISIÇÃO DE MATERIAIS DE LIMPEZA, HIGIENE E DESCARTÁVEIS, PARA SUPRIR AS NECESSIDADES DAS SECRETARIAS E FUNDOS ESPECIAIS DO MUNICÍPIO DE BOA SAÚDE/RN.;1242451.19;;ORIGINAL
2026-01-16;Dispensa;Portalegre;MUNICIPIO DE PORTALEGRE;AQUISIÇÃO;OUTROS;AQUISIÇÃO - OUTROS;1.1. Aquisição de meio-fio de concreto pré-moldado, nas dimensões 80x30x10 cm, destinado à contenção lateral e acabamento das vias que estão recebendo pavimentação asfáltica na comunidade de Baixa Grande, zona rural do Município de Portalegre/RN;60000.0;;ORIGINAL
2026-01-16;Pregão;Porto do Mangue;MUNICIPIO DE PORTO DO MANGUE;AQUISIÇÃO;OUTROS;AQUISIÇÃO - OUTROS;REGISTRO DE PREÇOS PARA CONTRATAÇÃO DE EMPRESA PARA O FORNECIMENTO DE ITENS PERMANENTES PARA COPA E COZINHA DAS DIVERSAS SECRETARIAS DO MUNICÍPIO DE PORTO DO MANGUE – RN.;240526.0;http://compras.m2atecnologia.com.br/processos/publicacao/2b91d548eb244c2ea27708cf5b265bab/registro-de-precos-para-contratacao-de-empresa-par;ORIGINAL
2026-01-16;Dispensa;Pau dos Ferros;MUNICIPIO DE PAU DOS FERROS;AQUISIÇÃO;OUTROS;AQUISIÇÃO - OUTROS;Contratação de empresa especializada na prestação de serviços de 7ª revisão de garantia programada de 130.000KM, incluindo o fornecimento de peças e acessórios para veículo FIAT DUCATO MULTI 2.2, de PLACA RQJ7D70, pertencente a frota da Secretaria Municipal de Saúde - SESAU.;693.89;;ORIGINAL
2026-01-16;Pregão;Baraúna;MUNICIPIO DE BARAUNA;AQUISIÇÃO;SAÚDE - MEDICAMENTOS;AQUISIÇÃO - SAÚDE - MEDICAMENTOS;[Portal de Compras Públicas] - A CONTRATAÇÃO DE PESSOA JURÍDICA PARA AQUISIÇÃO DE MEDICAMENTOS DE CONTROLE ESPECIAL DA PORTARIA Nº 344/98, DESTINADOS A ATENDER AS NECESSIDADES DA FARMÁCIA BÁSICA, E DO HOSPITAL E MATERNIDADE FRANCISCO BEZERRA SOBRINHO DO MUNICÍPIO DE BARAÚNA/RN.;3586241.5;https://portaldecompraspublicas.com.br/processos/RN/Prefeitura-Municipal-de-Barauna-1473/PE-002-2026-2026-448947;ORIGINAL
2026-01-16;Dispensa;Caraúbas;MUNICIPIO DE CARAUBAS;AQUISIÇÃO;OUTROS;AQUISIÇÃO - OUTROS;CONTRATAÇÃO DE PESSOA JURÍDICA PARA PRESTAÇÃO DE SERVIÇOS DE MONITORAMENTO por câmeras de vídeo, compreendendo planejamento técnico, fornecimento, instalação, operação assistida, suporte técnico e retirada dos equipamentos durante a Festa de São Sebastião de Caraúbas/RN – Edição 2026, atendendo às demandas da Secretaria Municipal de Cultura e Turismo do Município de Caraúbas/RN.;24830.63;;ORIGINAL
2026-01-16;Dispensa;Natal;RIO GRANDE DO NORTE TRIBUNAL DE JUSTICA DO ESTADO;AQUISIÇÃO;OUTROS;AQUISIÇÃO - OUTROS;Contratação de empresa para prestação do serviço de produção e execução de corrida de rua a ser realizada, com distâncias de 3 e 5 km, com largada e chegada na sede do Tribunal de Justiça do Rio Grande do Norte (TJRN), para um público de 600 pessoas, no dia 2 de novembro de 2025.;54951.5;;ORIGINAL
2026-01-16;Dispensa;Natal;RIO GRANDE DO NORTE TRIBUNAL DE JUSTICA DO ESTADO;AQUISIÇÃO;OUTROS;AQUISIÇÃO - OUTROS;Contratação de Prestador de Serviços Turísticos para Prestação dos Serviços de Hospedagem, para acomodar Jurados, testemunhas, Oficiais de Justiça e policiais em virtude da realização de julgamento do Tribunal do Júri, das varas Criminais da Comarca de Natal, com entrada no dia 01 de dezembro e saída no dia 05 de dezembro de 2025.;9895.0;;ORIGINAL
2026-01-16;Pregão;Natal;RIO GRANDE DO NORTE SECRETARIA DA SAUDE PUBLICA;AQUISIÇÃO;OUTROS;AQUISIÇÃO - OUTROS;A presente licitação tem por objeto o Registro de Preços com vistas à aquisição de CPAB bolha atender às necessidades dos Hospitais da Secretaria Estadual de Saúde do Rio Grande do Norte (SESAP), conforme condições, quantidades e exigências estabelecidas no Termo de Referência, através de um REGISTRO DE PREÇO. Previsto no Plano de contratações :Id pca PNCP: 08241754000145-0-000001/2025 , PCA 2025 - 925550 - ERN - SECRETARIA DE ESTADO DE SAÚDE PÚBLICA.;0.0;https://cnetmobile.estaleiro.serpro.gov.br/comprasnet-web/public/landing?destino=acompanhamento-compra&compra=92555005900072026;ORIGINAL
2026-01-16;Pregão;Santana do Seridó;MUNICIPIO DE SANTANA DO SERIDO;AQUISIÇÃO;OUTROS;AQUISIÇÃO - OUTROS;Registro de preço para futura, eventual e parcelada contratação de empresa para serviços de borracharia, destinadas a atender as demandas dos veículos que compõem a frota do município de Santana do Seridó/RN.;160920.0;;ORIGINAL
2026-01-16;Pregão;Barcelona;MUNICIPIO DE BARCELONA;AQUISIÇÃO;SAÚDE - MEDICAMENTOS;AQUISIÇÃO - SAÚDE - MEDICAMENTOS;[Portal de Compras Públicas] - Aquisição de medicamentos de controle especial.;0.0;https://portaldecompraspublicas.com.br/processos/RN/Prefeitura-Municipal-de-Barcelona-1085/RPE-016-2026-2026-448555;ORIGINAL
2026-01-16;Dispensa;Extremoz;SERVICO AUTONOMO DE AGUA E ESGOTO;AQUISIÇÃO;OUTROS;AQUISIÇÃO - OUTROS;Contratação de serviço de comunicação digital, para produção, edição e captação de imagens e filmagens, bem como a criação de conteúdo para veiculação nos meios de comunicação social, visando atender as demandas do Serviço Autônomo de Água e Esgoto de Extremoz/RN;55407.96;;ORIGINAL
2026-01-16;Pregão;Currais Novos;MUNICIPIO DE CURRAIS NOVOS;AQUISIÇÃO;OUTROS;AQUISIÇÃO - OUTROS;Registro de preço para futura e eventual aquisição de geradores com a finalidade de atender demandas das Secretarias Municipais.;0.0;https://cnetmobile.estaleiro.serpro.gov.br/comprasnet-web/public/landing?destino=acompanhamento-compra&compra=98166105900012026;ORIGINAL
2026-01-16;Dispensa;Natal;RIO GRANDE DO NORTE TRIBUNAL DE JUSTICA DO ESTADO;AQUISIÇÃO;OUTROS;AQUISIÇÃO - OUTROS;Contratação de empresa para fornecimento de licença de uso anual de ferramenta web de pesquisa e comparação de preços praticados pela Administração Pública.;15900.0;;ORIGINAL
2026-01-16;Dispensa;Lagoa Salgada;MUNICIPIO DE LAGOA SALGADA;AQUISIÇÃO;EVENTOS E CULTURA;AQUISIÇÃO - EVENTOS E CULTURA;CONTRATAÇÃO DE SHOW MUSICAL COM TRIO PÉ DE SERRA, PARA REALIZAÇÃO DO FORRÓ DA TERCEIRA IDADE COM OS IDOSOS ASSISTIDOS PELO SERVIÇO DE CONVIVÊNCIA E FORTALECIMENTO DE VÍNCULO, JUNTO A SECRETARIA MUNICIPAL DE ASSISTÊNCIA SOCIAL E TRABALHO NO MUNICÍPIO DE LAGOA SALGADA/RN.;33600.0;;ORIGINAL
2026-01-16;Pregão;Baraúna;MUNICIPIO DE BARAUNA;AQUISIÇÃO;SAÚDE - MEDICAMENTOS;AQUISIÇÃO - SAÚDE - MEDICAMENTOS;[Portal de Compras Públicas] - CONTRATAÇÃO DE PESSOA JURÍDICA VISANDO A AQUISIÇÃO DE MEDICAMENTOS DESTINADOS A ATENDER AS NECESSIDADES DO HOSPITAL E MATERNIDADE FRANCISCO BEZERRA SOBRINHO DO MUNICÍPIO DE BARAÚNA/RN.;3276808.0;https://portaldecompraspublicas.com.br/processos/RN/Prefeitura-Municipal-de-Barauna-1473/PE-001-2026-2026-450140;ORIGINAL
2026-01-16;Dispensa;Januário Cicco;MUNICIPIO DE BOA SAUDE;AQUISIÇÃO;OUTROS;AQUISIÇÃO - OUTROS;contratação de empresa especializada na prestação de serviços de lavagem, higienização interna e externa de veículos automotores, incluindo carros de passeio, utilitários, motocicletas, ônibus e demais veículos pertencentes ou a serviço das diversas secretarias da Administração Pública Municipal de Boa Saúde/RN.;62571.4;;ORIGINAL
2026-01-16;Dispensa;Macau;MUNICIPIO DE MACAU;AQUISIÇÃO;OUTROS;AQUISIÇÃO - OUTROS;Contratação de pessoa jurídica para coleta, transporte, tratamento e destino final (incineração)dos resíduos dos serviços de saúde no município de Macau/RN.;57420.0;;ORIGINAL
2026-01-16;Pregão;Açu;MUNICIPIO DE ASSU;AQUISIÇÃO;SAÚDE - MEDICAMENTOS;AQUISIÇÃO - SAÚDE - MEDICAMENTOS;[Portal de Compras Públicas] - Registro de Preços para aquisição de medicamentos básicos, destinados a suprir as necessidades da rede municipal de saúde do Município de Assú/RN.;11107730.6;https://portaldecompraspublicas.com.br/processos/RN/Prefeitura-Municipal-de-Assu-1270/RPE-033-2025-2026-450266;ORIGINAL
2026-01-16;Dispensa;Macau;MUNICIPIO DE MACAU;AQUISIÇÃO;OUTROS;AQUISIÇÃO - OUTROS;Aquisição de insumos odontológicos para atender as necessidades da Secretaria Municipal de Saúde de Macau/RN;1285199.75;;ORIGINAL
2026-01-16;Pregão;Passa e Fica;MUNICIPIO DE PASSA E FICA;AQUISIÇÃO;OUTROS;AQUISIÇÃO - OUTROS;Contratação de empresa para fornecimento de Materiais, Equipamentos e Insumos Odontológico, destinados para atender as demandas dos Serviços de Saúde da Secretaria Municipal de Saúde de Passa e Fica/RN.;2086966.62;;ORIGINAL
2026-01-16;Pregão;Lagoa Salgada;MUNICIPIO DE LAGOA SALGADA;OBRAS;EDIFICAÇÕES PÚBLICAS;OBRAS - EDIFICAÇÕES PÚBLICAS;CONTRATAÇÃO DE EMPRESA ESPECIALIZADA PARA PRESTAÇÃO DE SERVIÇOS DE REFORMA, ADEQUAÇÃO E MANUTENÇÃO NOS PRÉDIOS PÚBLICOS DO MUNICÍPIO DE LAGOA SALGADA/RN;3899978.7;;ORIGINAL
2026-01-16;Pregão;Brejinho;MUNICIPIO DE BREJINHO;AQUISIÇÃO;OUTROS;AQUISIÇÃO - OUTROS;[Portal de Compras Públicas] - REGISTRO DE PREÇOS PARA AQUISIÇÃO DE JOGOS, BRINQUEDOS, MATERIAIS E EQUIPAMENTOS PEDAGÓGICOS, EDUCATIVOS, FISIOTERAPÊUTICOS, ESTIMULATÓRIOS E CORRELATOS PARA ATENDER AS NECESSIDADES DO MUNICÍPIO DE BREJINHO/RN;0.0;https://portaldecompraspublicas.com.br/processos/RN/Prefeitura-Municipal-de-Brejinho-1150/RPE-PE-02-2026-2026-450273;ORIGINAL
2026-01-16;Dispensa;Equador;MUNICIPIO DE EQUADOR;AQUISIÇÃO;OUTROS;AQUISIÇÃO - OUTROS;[Portal de Compras Públicas] - CONTRATAÇÃO DE EMPRESA PARA FORNECIMENTO DE GLP EM BOTIJÃO COM PESO DA CARGA 13 KG, PARA UTILIZAÇÃO DOMÉSTICA, VALOR DE REFERENCIA TABELA ANP REGIONAL CAICÓ;59375.0;https://portaldecompraspublicas.com.br/processos/RN/Prefeitura-Municipal-de-Equador-2468/DEMD-4-2026-2026-449301;ORIGINAL
2026-01-16;Pregão;Antônio Martins;MUNICIPIO DE ANTONIO MARTINS;AQUISIÇÃO;OUTROS;AQUISIÇÃO - OUTROS;Aquisição de 01 (um) veículo tipo caminhão pipa, zero quilômetro, trucado, com tração 6x4, capacidade volumétrica mínima de 12.000 (doze mil) litros, destinado ao transporte e distribuição de água, para atender às necessidades operacionais do Município de Antônio Martins/RN, em atendimento ao Convênio nº 049153/2025, celebrado com o Ministério da Integração e do Desenvolvimento Regional – MIDR, com recursos oriundos do referido convênio e contrapartida de recursos próprios do Município, conforme condições, especificações técnicas e quantitativos estabelecidos no edital e seus anexos.;0.0;;ORIGINAL
2026-01-16;Dispensa;Parnamirim;INSTITUTO FEDERAL DE EDUCACAO, CIENCIA E TECNOLOGIA DO RIO GRANDE DO NORTE;AQUISIÇÃO;OUTROS;AQUISIÇÃO - OUTROS;Contratação de serviço de manutenção preventiva e corretiva de robô industrial Mitsubishi RV2SDB (braço robótico) do IFRN - Parnamirim;23848.96;;ORIGINAL
2026-01-16;Dispensa;Jucurutu;MUNICIPIO DE JUCURUTU;AQUISIÇÃO;OUTROS;AQUISIÇÃO - OUTROS;AQUISIÇÃO GRADATIVA E EVENTUAL DE MATERIAL HIDRÁULICO PARA ATENDER DEMANDA EMERGENCIAL DA SECRETARIA DE AGRICULTURA DE COMBATE A SECA.;53655.16;;ORIGINAL
2026-01-16;Dispensa;Equador;MUNICIPIO DE EQUADOR;AQUISIÇÃO;FROTA E COMBUSTÍVEL;AQUISIÇÃO - FROTA E COMBUSTÍVEL;Contratação de empresa para locação de ambulância, destinada ao atendimento das demandas da Secretaria Municipal de Saúde, com disponibilização imediata, condutor e combustivel por conta do contratante e manutenção preventiva e corretiva por conta do contratante;65200.0;;ORIGINAL
2026-01-16;Dispensa;Natal;CONSELHO REGIONAL DOS REPRESENTANTES COMERCIAIS NO ESTADO DO RIO GRANDE DO NORTE;SERVIÇOS;OUTROS;SERVIÇOS - OUTROS;Aquisição de materiais de higiene e limpeza, com ENTREGA ÚNICA, para atender a demanda do Core-RN, conforme as especificações e os quantitativos informados no Termo de Referência.;9501.76;;ORIGINAL
2026-01-16;Dispensa;Natal;CONSELHO REGIONAL DE FARMACIA;AQUISIÇÃO;OUTROS;AQUISIÇÃO - OUTROS;Contratação de prestador de serviços para execução dos serviços de manutenção preventiva e corretiva dos aparelhos de ar-condicionado desta autarquia, sem fornecimento e reposição de peças, no exercício de 2026, visando manter os mesmos em boas condições (manutenção e conservação) pelo período de 12 (doze) meses.;63399.96;;ORIGINAL
2026-01-16;Dispensa;Natal;COMANDO DA MARINHA;AQUISIÇÃO;OUTROS;AQUISIÇÃO - OUTROS;O objeto da presente dispensa é a escolha da proposta mais vantajosa para a contratação, por dispensa de licitação, de empresa para serviço de utilização, por meio do fornecimento de arquivos e licenças, de cartas eletrônicas internacionais, para a comissão OBANGAME EXPRESS-2026 / GUINEX-VI / 70 ANOS DA MARINHA NIGÉRIA;3700.0;;ORIGINAL
2026-01-16;Dispensa;Natal;COMANDO DA MARINHA;AQUISIÇÃO;OUTROS;AQUISIÇÃO - OUTROS;O objeto da presente dispensa é a escolha da proposta mais vantajosa para a contratação, por dispensa de licitação, de materiais de marinharia;50516.2;;ORIGINAL
2026-01-16;Dispensa;Natal;COMANDO DA MARINHA;AQUISIÇÃO;OUTROS;AQUISIÇÃO - OUTROS;O objeto da presente dispensa é a escolha da proposta mais vantajosa para a contratação, por dispensa de licitação, de materiais de remoção de ferrugem e pintura;21852.3;;ORIGINAL
2026-01-16;Dispensa;Natal;COMANDO DA MARINHA;AQUISIÇÃO;OUTROS;AQUISIÇÃO - OUTROS;O objeto da presente dispensa é a escolha da proposta mais vantajosa para a contratação, por dispensa de licitação, de tintas;64920.0;;ORIGINAL
2026-01-16;Dispensa;Bom Jesus;BOM JESUS CAMARA MUNICIPAL;SERVIÇOS;OUTROS;SERVIÇOS - OUTROS;Aquisição de gêneros alimentícios e materiais de limpeza, com vistas a atender às necessidades operacionais e administrativas da Câmara Municipal de Vereadores de Bom Jesus/RN.;45950.0;;ORIGINAL
2026-01-16;Dispensa;Várzea;MUNICIPIO DE VARZEA;AQUISIÇÃO;OUTROS;AQUISIÇÃO - OUTROS;CONTRATAÇÃO DE EMPRESA PARA SERVIÇOS DIVERSOS COM GESSO EM PRÉDIOS PÚBLICOS NO MUNICÍPIO DE VÁRZEA/RN.;105006.13;;ORIGINAL
2026-01-16;Pregão;Santa Cruz;MUNICIPIO DE SANTA CRUZ;AQUISIÇÃO;OUTROS;AQUISIÇÃO - OUTROS;Registro de preços para possível contratação de empresa especializada em locação de trio elétrico, para utilização em datas comemorativas do calendário de festividades do Município de Santa Cruz/RN;260679.96;;ORIGINAL
2026-01-16;Pregão;Santa Cruz;MUNICIPIO DE SANTA CRUZ;AQUISIÇÃO;OUTROS;AQUISIÇÃO - OUTROS;[Portal de Compras Públicas] - Registro de preços para possível contratação de empresa especializada em locação de trio elétrico, para utilização em datas comemorativas do calendário de festividades do Município de Santa Cruz/RN;260679.96;https://portaldecompraspublicas.com.br/processos/RN/Prefeitura-Municipal-de-Santa-Cruz-1190/RPE-3-2026-2026-450325;ORIGINAL
2026-01-16;Dispensa;Pau dos Ferros;MUNICIPIO DE PAU DOS FERROS;AQUISIÇÃO;OUTROS;AQUISIÇÃO - OUTROS;Processo de despesa destinado a contratação de empresa especializada para aquisição de licença de uso de software de gerenciamento de analises clínicas, a fim de atender demanda da Secretaria Municipal de Saúde – SESAU.;1800.0;;ORIGINAL
