ID_Unico;Data;Modalidade;Cidade;Órgão;Natureza;Função;Categoria_Final;Objeto;Valor;Link
https://portaldecompraspublicas.com.br/processos/RN/Prefeitura-Municipal-de-Bodo-1316/DE-02-2026-2026-452854;2026-01-29;Dispensa;Bodó;MUNICIPIO DE BODO;AQUISIÇÃO;OUTROS;AQUISIÇÃO - OUTROS;[Portal de Compras Públicas] - CONTRATAÇÃO DE EMPRESA PARA AQUISIÇÃO DE FRISADORES DE ALUMÍNIO PARA FABRICAÇÃO DE FLORES ARTIFICIAIS EM EVA E TECIDOS VISANDO ATENDER AS NECESSIDADES DA SECRETARIA MUNICIPAL DE TRABALHO, HABITAÇÃO E ASSISTÊNCIA SOCIAL DA PREFEITURA MUNICIPAL DE BODÓ/RN.;6143.0;https://portaldecompraspublicas.com.br/processos/RN/Prefeitura-Municipal-de-Bodo-1316/DE-02-2026-2026-452854
https://portaldecompraspublicas.com.br/processos/RN/Prefeitura-Municipal-de-Bodo-1316/DE-03-2026-2026-453148;2026-01-29;Dispensa;Bodó;MUNICIPIO DE BODO;AQUISIÇÃO;OUTROS;AQUISIÇÃO - OUTROS;[Portal de Compras Públicas] - REGISTRO DE PREÇO PARA FUTURA E EVENTUAL LOCAÇÃO DE CAMINHÃO LIMPA FOSSA PARA ATENDER AS NECESSIDADES DA SECRETARIA MUNICIPAL DE MEIO AMBIENTE DA PREFEITURA MUNICIPAL DE BODÓ/RN.;61983.0;https://portaldecompraspublicas.com.br/processos/RN/Prefeitura-Municipal-de-Bodo-1316/DE-03-2026-2026-453148
https://portaldecompraspublicas.com.br/processos/RN/Prefeitura-Municipal-de-Bodo-1316/DE-04-2026-2026-453165;2026-01-29;Dispensa;Bodó;MUNICIPIO DE BODO;AQUISIÇÃO;OUTROS;AQUISIÇÃO - OUTROS;[Portal de Compras Públicas] - CONTRATAÇÃO DE EMPRESA PARA REALIZAÇÃO DE EXAMES DE DIAGNÓSTICO POR IMAGEM, SENDO ARTERIOGRAFIA DE MEMBROS INFERIORES E ANGIOTOMOGRAFIA DAS CORONÁRIAS, PARA ATENDER AS NECESSIDADES DA SECRETARIA DE SAÚDE DO MUNICÍPIO DE BODÓ/RN;6652.66;https://portaldecompraspublicas.com.br/processos/RN/Prefeitura-Municipal-de-Bodo-1316/DE-04-2026-2026-453165
https://www.portaldecompraspublicas.com.br ;2026-01-29;Dispensa;Natal;CONSELHO REGIONAL DE EDUCACAO FISICA DA 16 REGIAO - CREF16/RN;SERVIÇOS;OUTROS;SERVIÇOS - OUTROS;Contratação de empresa especializada na prestação de serviços de assessoria e apoio administrativo nos processos de licitação e contratações diretas de bens e serviços do Conselho Regional de Educação Física do Rio Grande do Norte – CREF16/RN, através do auxílio na elaboração e revisão dos documentos exigidos pela Lei 14.133/2021 e demais legislações correlatas, garantindo maior celeridade ao setor de licitações do órgão, conforme as condições e especificações a seguir definidas.;0.0;https://www.portaldecompraspublicas.com.br 
https://portaldecompraspublicas.com.br/processos/RN/Prefeitura-Municipal-de-Sao-Fernando-1137/DE-005-2026-2026-453211;2026-01-29;Dispensa;São Fernando;MUNICIPIO DE SAO FERNANDO;AQUISIÇÃO;OUTROS;AQUISIÇÃO - OUTROS;[Portal de Compras Públicas] - Aquisição de material permanente pela secretaria municipal de educação, cultura e lazer, com o intuito de estruturar novas salas de aula para o início do novo ano letivo no município de São Fernando/RN.;51250.0;https://portaldecompraspublicas.com.br/processos/RN/Prefeitura-Municipal-de-Sao-Fernando-1137/DE-005-2026-2026-453211
http://compras.m2atecnologia.com.br/processos/publicacao/4580233b368949aea47c8ade73a54ef7/contratacao-da-prestacao-de-servicos-tecnicos-prof;2026-01-29;Dispensa;Encanto;ENCANTO CAMARA MUNICIPAL;SERVIÇOS;OUTROS;SERVIÇOS - OUTROS;Contratação da prestação de serviços técnicos profissionais em assessoria para o Setor de Recursos humanos da Câmara Municipal de Encanto;60200.04;http://compras.m2atecnologia.com.br/processos/publicacao/4580233b368949aea47c8ade73a54ef7/contratacao-da-prestacao-de-servicos-tecnicos-prof
https://portaldecompraspublicas.com.br/processos/RN/Secretaria-Municipal-de-Igualdade-Racial-e-Direitos-Humanos-de-Natal-SEMIDH-4649/DE-001-2026-2026-453244;2026-01-29;Dispensa;Natal;MUNICIPIO DE NATAL;AQUISIÇÃO;OUTROS;AQUISIÇÃO - OUTROS;[Portal de Compras Públicas] - Aquisição de materiais e equipamentos de informática diversos, com o objetivo de garantir a continuidade e a eficiência das atividades administrativas da Secretaria Municipal da Igualdade Racial, Direitos Humanos, Diversidade, Pessoa Idosa e Pessoa com Deficiência – SEMIDH.;6116.77;https://portaldecompraspublicas.com.br/processos/RN/Secretaria-Municipal-de-Igualdade-Racial-e-Direitos-Humanos-de-Natal-SEMIDH-4649/DE-001-2026-2026-453244
https://transparencia.agilirn.com.br/prefipanguacu-rn/licitacoes/licitacao?id=105;2026-01-29;Dispensa;Ipanguaçu;MUNICIPIO DE IPANGUACU;OBRAS;INFRAESTRUTURA URBANA;OBRAS - INFRAESTRUTURA URBANA;contratação de empresa especializada para a execução da DRENAGEM DE AGUAS PLUVIAIS- CANAL- o bairro- COHAB, no município de Ipanguaçu- RN;33356.55;https://transparencia.agilirn.com.br/prefipanguacu-rn/licitacoes/licitacao?id=105
http://compras.m2atecnologia.com.br/processos/publicacao/dc58646bdb94412782d05190e4f04dc2/a-camara-municipal-de-encanto-necessita-de-meios-e;2026-01-29;Dispensa;Encanto;ENCANTO CAMARA MUNICIPAL;AQUISIÇÃO;OUTROS;AQUISIÇÃO - OUTROS;A Câmara Municipal de Encanto necessita de meios eficientes para gerenciar e otimizar os processos administrativos relacionados a compras públicas, garantindo a conformidade com as normas legais e a eficiência operacional.;13723.33;http://compras.m2atecnologia.com.br/processos/publicacao/dc58646bdb94412782d05190e4f04dc2/a-camara-municipal-de-encanto-necessita-de-meios-e
https://portaldecompraspublicas.com.br/processos/RN/Secretaria-Municipal-de-Planejamento-de-Natal-3229/DE-02-2026-2026-452909;2026-01-29;Dispensa;Natal;MUNICIPIO DE NATAL;AQUISIÇÃO;OUTROS;AQUISIÇÃO - OUTROS;[Portal de Compras Públicas] - Aquisição de certificados SSL/TLS Wildcard OV e OV ICP Brasil;8437.98;https://portaldecompraspublicas.com.br/processos/RN/Secretaria-Municipal-de-Planejamento-de-Natal-3229/DE-02-2026-2026-452909
https://transparencia.agilirn.com.br/prefipanguacu-rn/licitacoes/licitacao?id=116;2026-01-29;Dispensa;Ipanguaçu;MUNICIPIO DE IPANGUACU;AQUISIÇÃO;OUTROS;AQUISIÇÃO - OUTROS;CONTRATAÇÃO DE EMPRESA ESPECIALIZADA NA PRESTAÇAO DE SERVIÇOS EVENTUAIS DE LOCAÇÃO, MONTAGEM, DESMONTAGEM, OPERAÇAO E FORNECIMENTO DE MATERIALS PARA ESTRUTURA DE RECREAÇAO INFANTIL, INCLUINDO BRINQUEDOS INFLAVEIS, CAMAS ELASTICAS, EQUIPAMENTOS DE ALIMENTAÇAO (ALGODAO DOCE E PIPOCA) E FANTASIAS LÚDICAS COM PERSONAGENS VIVOS, A SEREM UTILIZADOS EM EVENTOS REALIZADOS PELA SECRETARIA MUNICIPAL DO TRABALHO, HABITAÇAO E ASSISTENCIA SOCIAL DA PREFEITURA MUNICIPAL DE IPANGUAQU/RN.;61200.0;https://transparencia.agilirn.com.br/prefipanguacu-rn/licitacoes/licitacao?id=116
https://transparencia.agilirn.com.br/prefipanguacu-rn/licitacoes/licitacao?id=133;2026-01-29;Dispensa;Ipanguaçu;MUNICIPIO DE IPANGUACU;AQUISIÇÃO;OUTROS;AQUISIÇÃO - OUTROS;Contratação de empresa especializada em aquisição de material e equipamentos para Agentes Comunitários de Endemias da Secretaria Municipal de Saúde Ipanguaçu/RN.;17854.0;https://transparencia.agilirn.com.br/prefipanguacu-rn/licitacoes/licitacao?id=133
https://transparencia.agilirn.com.br/prefcarnaubadantas-rn/licitacoes/licitacao?id=1470;2026-01-30;Dispensa;Carnaúba dos Dantas;MUNICIPIO DE CARNAUBA DOS DANTAS;AQUISIÇÃO;OUTROS;AQUISIÇÃO - OUTROS;CONTRATAÇÃO DE EMPRESA ESPECIALIZADA NA PRESTAÇÃO DE SERVIÇOS DE CHAVEIRO, DESTINADOS A ATENDER ÀS DEMANDAS DA SECRETARIA MUNICIPAL DE EDUCAÇÃO DO MUNICÍPIO DE CARNAÚBA DOS DANTAS/RN;2600.0;https://transparencia.agilirn.com.br/prefcarnaubadantas-rn/licitacoes/licitacao?id=1470
https://transparencia.agilirn.com.br/camsaorafael-rn/licitacoes/licitacao?id=39;2026-01-30;Dispensa;São Rafael;SAO RAFAEL CAMARA MUNICIPAL;AQUISIÇÃO;OUTROS;AQUISIÇÃO - OUTROS;CONTRATAÇÃO DE PESSOA JURÍDICA NA PRESTAÇÃO DE SERVIÇOS DE CERTIFICAÇÃO DIGITAL, NO PADRÃO ICP-BRASIL, INCLUINDO A EMISSÃO, VALIDAÇÃO E/OU RENOVAÇÃO DE CERTIFICADOS DIGITAIS E O RESPECTIVO SUPORTE TÉCNICO, VISANDO ATENDER ÀS NECESSIDADES OPERACIONAIS E ADMINISTRATIVAS DA CÂMARA MUNICIPAL DE SÃO RAFAEL/RN;1074.0;https://transparencia.agilirn.com.br/camsaorafael-rn/licitacoes/licitacao?id=39
http://compras.m2atecnologia.com.br/processos/publicacao/883f15419ec5473caee24f25d0ca8bbb/contratacao-da-prestacao-de-servicos-de-fornecimen;2026-01-30;Dispensa;Encanto;ENCANTO CAMARA MUNICIPAL;AQUISIÇÃO;OUTROS;AQUISIÇÃO - OUTROS;contratação da prestação de serviços de fornecimento de Internet para suprir as demandas da Câmara Municipal de Encanto-RN;8201.4;http://compras.m2atecnologia.com.br/processos/publicacao/883f15419ec5473caee24f25d0ca8bbb/contratacao-da-prestacao-de-servicos-de-fornecimen
http://datacenter.aossoftware.com.br:8173/transparencia/;2026-01-30;Dispensa;Acari;ACARI CAMARA MUNICIPAL;AQUISIÇÃO;OUTROS;AQUISIÇÃO - OUTROS;Emissão e validação presencial de certificados digitais para atender as necessidades da Câmara Municipal de Acari/RN.;3830.23;http://datacenter.aossoftware.com.br:8173/transparencia/
https://transparencia.agilirn.com.br/prefcarnaubadantas-rn/licitacoes/licitacao?id=1469;2026-01-30;Dispensa;Carnaúba dos Dantas;MUNICIPIO DE CARNAUBA DOS DANTAS;AQUISIÇÃO;OUTROS;AQUISIÇÃO - OUTROS;AQUISIÇÃO DE CAMINHA EMPILHÁVEL INFANTIL PARA ATENDIMENTO DAS NECESSIDADES DAS UNIDADES DE EDUCAÇÃO INFANTIL DA REDE PÚBLICA MUNICIPAL;17141.6;https://transparencia.agilirn.com.br/prefcarnaubadantas-rn/licitacoes/licitacao?id=1469
