Data;Modalidade;Cidade;Órgão;Natureza;Função;Categoria_Final;Objeto;Valor;Link;Status_Duplicidade
;Pregão;Januário Cicco;MUNICIPIO DE BOA SAUDE;SERVIÇOS;OUTROS;SERVIÇOS - OUTROS;FORMAÇÃO DE REGISTRO DE PREÇOS PARA FUTURA CONTRATAÇÃO DE EMPRESA PARA AQUISIÇÃO DE MATERIAIS DE LIMPEZA, HIGIENE E DESCARTÁVEIS, PARA SUPRIR AS NECESSIDADES DAS SECRETARIAS E FUNDOS ESPECIAIS DO MUNICÍPIO DE BOA SAÚDE/RN.;1242451.19;;REPETIDO
;Pregão;Porto do Mangue;MUNICIPIO DE PORTO DO MANGUE;AQUISIÇÃO;OUTROS;AQUISIÇÃO - OUTROS;REGISTRO DE PREÇOS PARA CONTRATAÇÃO DE EMPRESA PARA O FORNECIMENTO DE ITENS PERMANENTES PARA COPA E COZINHA DAS DIVERSAS SECRETARIAS DO MUNICÍPIO DE PORTO DO MANGUE – RN.;240526.0;http://compras.m2atecnologia.com.br/processos/publicacao/2b91d548eb244c2ea27708cf5b265bab/registro-de-precos-para-contratacao-de-empresa-par;REPETIDO
;Pregão;Baraúna;MUNICIPIO DE BARAUNA;AQUISIÇÃO;SAÚDE - MEDICAMENTOS;AQUISIÇÃO - SAÚDE - MEDICAMENTOS;[Portal de Compras Públicas] - A CONTRATAÇÃO DE PESSOA JURÍDICA PARA AQUISIÇÃO DE MEDICAMENTOS DE CONTROLE ESPECIAL DA PORTARIA Nº 344/98, DESTINADOS A ATENDER AS NECESSIDADES DA FARMÁCIA BÁSICA, E DO HOSPITAL E MATERNIDADE FRANCISCO BEZERRA SOBRINHO DO MUNICÍPIO DE BARAÚNA/RN.;3586241.5;https://portaldecompraspublicas.com.br/processos/RN/Prefeitura-Municipal-de-Barauna-1473/PE-002-2026-2026-448947;REPETIDO
;Pregão;Santana do Seridó;MUNICIPIO DE SANTANA DO SERIDO;AQUISIÇÃO;OUTROS;AQUISIÇÃO - OUTROS;Registro de preço para futura, eventual e parcelada contratação de empresa para serviços de borracharia, destinadas a atender as demandas dos veículos que compõem a frota do município de Santana do Seridó/RN.;160920.0;;REPETIDO
;Pregão;Baraúna;MUNICIPIO DE BARAUNA;AQUISIÇÃO;SAÚDE - MEDICAMENTOS;AQUISIÇÃO - SAÚDE - MEDICAMENTOS;[Portal de Compras Públicas] - CONTRATAÇÃO DE PESSOA JURÍDICA VISANDO A AQUISIÇÃO DE MEDICAMENTOS DESTINADOS A ATENDER AS NECESSIDADES DO HOSPITAL E MATERNIDADE FRANCISCO BEZERRA SOBRINHO DO MUNICÍPIO DE BARAÚNA/RN.;3276808.0;https://portaldecompraspublicas.com.br/processos/RN/Prefeitura-Municipal-de-Barauna-1473/PE-001-2026-2026-450140;REPETIDO
;Pregão;Açu;MUNICIPIO DE ASSU;AQUISIÇÃO;SAÚDE - MEDICAMENTOS;AQUISIÇÃO - SAÚDE - MEDICAMENTOS;[Portal de Compras Públicas] - Registro de Preços para aquisição de medicamentos básicos, destinados a suprir as necessidades da rede municipal de saúde do Município de Assú/RN.;11107730.6;https://portaldecompraspublicas.com.br/processos/RN/Prefeitura-Municipal-de-Assu-1270/RPE-033-2025-2026-450266;REPETIDO
;Pregão;Passa e Fica;MUNICIPIO DE PASSA E FICA;AQUISIÇÃO;OUTROS;AQUISIÇÃO - OUTROS;Contratação de empresa para fornecimento de Materiais, Equipamentos e Insumos Odontológico, destinados para atender as demandas dos Serviços de Saúde da Secretaria Municipal de Saúde de Passa e Fica/RN.;2086966.62;;REPETIDO
;Pregão;Lagoa Salgada;MUNICIPIO DE LAGOA SALGADA;OBRAS;EDIFICAÇÕES PÚBLICAS;OBRAS - EDIFICAÇÕES PÚBLICAS;CONTRATAÇÃO DE EMPRESA ESPECIALIZADA PARA PRESTAÇÃO DE SERVIÇOS DE REFORMA, ADEQUAÇÃO E MANUTENÇÃO NOS PRÉDIOS PÚBLICOS DO MUNICÍPIO DE LAGOA SALGADA/RN;3899978.7;;REPETIDO
;Pregão;Brejinho;MUNICIPIO DE BREJINHO;AQUISIÇÃO;OUTROS;AQUISIÇÃO - OUTROS;[Portal de Compras Públicas] - REGISTRO DE PREÇOS PARA AQUISIÇÃO DE JOGOS, BRINQUEDOS, MATERIAIS E EQUIPAMENTOS PEDAGÓGICOS, EDUCATIVOS, FISIOTERAPÊUTICOS, ESTIMULATÓRIOS E CORRELATOS PARA ATENDER AS NECESSIDADES DO MUNICÍPIO DE BREJINHO/RN;0.0;https://portaldecompraspublicas.com.br/processos/RN/Prefeitura-Municipal-de-Brejinho-1150/RPE-PE-02-2026-2026-450273;REPETIDO
;Pregão;Antônio Martins;MUNICIPIO DE ANTONIO MARTINS;AQUISIÇÃO;OUTROS;AQUISIÇÃO - OUTROS;Aquisição de 01 (um) veículo tipo caminhão pipa, zero quilômetro, trucado, com tração 6x4, capacidade volumétrica mínima de 12.000 (doze mil) litros, destinado ao transporte e distribuição de água, para atender às necessidades operacionais do Município de Antônio Martins/RN, em atendimento ao Convênio nº 049153/2025, celebrado com o Ministério da Integração e do Desenvolvimento Regional – MIDR, com recursos oriundos do referido convênio e contrapartida de recursos próprios do Município, conforme condições, especificações técnicas e quantitativos estabelecidos no edital e seus anexos.;0.0;;REPETIDO
;Pregão;Santa Cruz;MUNICIPIO DE SANTA CRUZ;AQUISIÇÃO;OUTROS;AQUISIÇÃO - OUTROS;Registro de preços para possível contratação de empresa especializada em locação de trio elétrico, para utilização em datas comemorativas do calendário de festividades do Município de Santa Cruz/RN;260679.96;;REPETIDO
;Pregão;Santa Cruz;MUNICIPIO DE SANTA CRUZ;AQUISIÇÃO;OUTROS;AQUISIÇÃO - OUTROS;[Portal de Compras Públicas] - Registro de preços para possível contratação de empresa especializada em locação de trio elétrico, para utilização em datas comemorativas do calendário de festividades do Município de Santa Cruz/RN;260679.96;https://portaldecompraspublicas.com.br/processos/RN/Prefeitura-Municipal-de-Santa-Cruz-1190/RPE-3-2026-2026-450325;REPETIDO
;Pregão;Fernando Pedroza;MUNICIPIO DE FERNANDO PEDROZA;AQUISIÇÃO;OUTROS;AQUISIÇÃO - OUTROS;[Portal de Compras Públicas] - Registro de Preço para futura e eventual aquisição de insumos médicos hospitalares, para atender a Secretaria Municipal de Saúde do município de Fernando Pedroza/RN.;0.0;https://portaldecompraspublicas.com.br/processos/RN/Prefeitura-Municipal-de-Fernando-Pedroza-1357/RPE-001-2026-2026-450292;REPETIDO
;Pregão;Macau;MUNICIPIO DE MACAU;OBRAS;OUTROS;OBRAS - OUTROS;[Portal de Compras Públicas] - Contratação de Serviços de Engenharia de Trânsito compreendendo, recuperação, fornecimento e instalação de semáforos nas vias públicas do município de Macau/RN;0.0;https://portaldecompraspublicas.com.br/processos/RN/Prefeitura-Municipal-de-Macau-1789/RPE-1-2026-2026-449789;REPETIDO
;Pregão;Natal;RIO G DO NORTE ASSEMBLEIA LEGISLATIVA DO RIO G DO NORTE;AQUISIÇÃO;OUTROS;AQUISIÇÃO - OUTROS;Registro de preços para eventual e futura aquisição e instalação de aparelhos de Ar-condicionado, conforme condições e exigências estabelecidas no Edital e seus anexos.;0.0;https://cnetmobile.estaleiro.serpro.gov.br/comprasnet-web/public/landing?destino=acompanhamento-compra&compra=92669705900012026;REPETIDO
;Pregão;Currais Novos;MUNICIPIO DE CURRAIS NOVOS;AQUISIÇÃO;OUTROS;AQUISIÇÃO - OUTROS;Contratação de serviço de manutenção para materias odontológicos permanentes destinados às unidades básicas de saúde e ao centro de especialidades odontológicas.;0.0;https://cnetmobile.estaleiro.serpro.gov.br/comprasnet-web/public/landing?destino=acompanhamento-compra&compra=98166105900022026;REPETIDO
;Pregão;Natal;EMPRESA BRASILEIRA DE SERVICOS HOSPITALARES - EBSERH;SERVIÇOS;OUTROS;SERVIÇOS - OUTROS;Contratação de empresa especializada para a prestação de serviço continuado de apoio para realização de exames laboratoriais especializados, a fim de atender as necessidades do Hospital Universitário Onofre Lopes, vinculado à Universidade Federal do Rio Grande do Norte pertencente à Rede da Empresa Brasileira de Serviços Hospitalares – Ebserh, por um período de 12 (doze) meses;0.0;https://cnetmobile.estaleiro.serpro.gov.br/comprasnet-web/public/landing?destino=acompanhamento-compra&compra=15501305900082026;REPETIDO
;Pregão;Natal;EMPRESA BRASILEIRA DE SERVICOS HOSPITALARES - EBSERH;AQUISIÇÃO;OUTROS;AQUISIÇÃO - OUTROS;Aquisição de materiais médico-hospitalares (Parte C), a fim de atender às necessidades da Maternidade Escola Januário Cicco - MEJC, filial da Empresa Brasileira de Serviços Hospitalares para um período de 12 (doze) meses, prorrogável por igual período, compreendendo os exercícios de 2025-2026.;0.0;https://cnetmobile.estaleiro.serpro.gov.br/comprasnet-web/public/landing?destino=acompanhamento-compra&compra=15501505900362025;REPETIDO
;Pregão;Serra Negra do Norte;MUNICIPIO DE SERRA NEGRA DO NORTE;AQUISIÇÃO;OUTROS;AQUISIÇÃO - OUTROS;AQUISIÇÃO DE INSUMOS PARA OS PACIENTES DIABÉTICOS DO MUNICÍPIO DE SERRA NEGRA DO NORTE/RN.;448683.5;;REPETIDO
;Pregão;Pau dos Ferros;PAU DOS FERROS CAMARA MUNICIPAL;AQUISIÇÃO;OUTROS;AQUISIÇÃO - OUTROS;Contratação de empresa concessionária autorizada, com vistas ao fornecimento de 01 (um) veículo automotor de passeio, com capacidade para 7 (sete) ocupantes, a ser destinado à Câmara Municipal de Pau dos Ferros/RN.;155505.0;;REPETIDO
;Pregão;Carnaúba dos Dantas;MUNICIPIO DE CARNAUBA DOS DANTAS;AQUISIÇÃO;OUTROS;AQUISIÇÃO - OUTROS;REGISTRO DE PREÇOS PARA CONTRATAÇÃO DE EMPRESA ESPECIALIZADA NO FORNECIMENTO DE MATERIAIS DIDÁTICOS, PEDAGÓGICOS E AVIAMENTOS PARA SUPORTE ÀS AÇÕES DA EDUCAÇÃO MUNICIPAL E ESCOLAS MUNICIPAIS;502454.55;https://transparencia.agilirn.com.br/prefcarnaubadantas-rn/licitacoes/licitacao?id=1462;REPETIDO
;Pregão;Natal;MUNICIPIO DE NATAL;OBRAS;OUTROS;OBRAS - OUTROS;REGISTRO DE PREÇO PARA FUTURA E EVENTUAL CONTRATAÇÃO DE EMPRESA ESPECIALIZADA EM SERVIÇOS DE ENGENHARIA/ARQUITETURA PARA A EXECUÇÃO DE SERVIÇOS CONTINUADOS DE CONSERVAÇÃO DE VIAS PAVIMENTADAS EM PARALELEPÍPEDO NOS BAIRROS DA ZONA SUL DE NATAL/RN, ABRANGENDO REMOÇÃO DO MATERIAL DANIFICADO, REPOSIÇÃO E REAPROVEITAMENTO DOS PARALELEPÍPEDOS,A REGULARIZAÇÃO DA CAMADA DE ASSENTAMENTO E A EXECUÇÃO DE COMPACTAÇÃO E NIVELAMENTO FINAL.;0.0;http://www.portaldecomprasnatal.com.br;REPETIDO
;Pregão;Natal;MUNICIPIO DE NATAL;OBRAS;OUTROS;OBRAS - OUTROS;REGISTRO DE PREÇO PARA FUTURA E EVENTUAL CONTRATAÇÃO DE EMPRESA ESPECIALIZADA EM SERVIÇOS DE ENGENHARIA/ARQUITETURA PARA A EXECUÇÃO DE SERVIÇOS CONTINUADOS DE CONSERVAÇÃO DE VIAS PAVIMENTADAS EM PARALELEPÍPEDO NOS BAIRROS DA ZONA LESTE DE NATAL/RN, ABRANGENDO REMOÇÃO DO MATERIAL DANIFICADO, A REPOSIÇÃO E REAPROVEITAMENTO DOS PARALELEPÍPEDOS, A REGULARIZAÇÃO DA CAMADA DE ASSENTAMENTO E A EXECUÇÃO DE COMPACTAÇÃO E NIVELAMENTO FINAL.;0.0;http://www.portaldecomprasnatal.com.br;REPETIDO
;Pregão;Natal;MUNICIPIO DE NATAL;OBRAS;INFRAESTRUTURA URBANA;OBRAS - INFRAESTRUTURA URBANA;CONTRATAÇÃO DE EMPRESA ESPECIALIZADA DE ENGENHARIA/ARQUITETURA PARA EXECUÇÃO DE SERVIÇOS DE DRENAGEM NAS RUA CORONEL CASCUDO, PRINCESA ISABEL E FELIPE CAMARÃO, CENTRO, BAIRRO CIDADE ALTA, NATAL/RN, EM CONFORMIDADE COM AS NORMAS TÉCNICAS APLICÁVEIS E DIRETRIZES DA PREFEITURA MUNICIPAL DE NATAL/RN.;359889.24;http://www.portaldecomprasnatal.com.br;REPETIDO
;Pregão;Tenente Laurentino Cruz;MUNICIPIO DE TENENTE LAURENTINO CRUZ;SERVIÇOS;OUTROS;SERVIÇOS - OUTROS;[Portal de Compras Públicas] - Contratação futura e eventual de empresa especializada para o fornecimento de materiais de limpeza, destinados ao atendimento das necessidades das diversas secretarias e órgãos da Prefeitura Municipal de Tenente Laurentino Cruz/RN.;1993544.56;https://portaldecompraspublicas.com.br/processos/RN/Prefeitura-Municipal-de-Tenente-Laurentino-Cruz-1598/RPE-39-2025-2025-2026-450495;REPETIDO
;Pregão;Pau dos Ferros;MUNICIPIO DE PAU DOS FERROS;AQUISIÇÃO;OUTROS;AQUISIÇÃO - OUTROS;Contratação de Empresa Especializada para execução de serviços de Manutenção do Revestimento Asfáltico Urbano, no Município de Pau dos Ferros - RN.;840039.22;;REPETIDO
;Concorrência;Mossoró;MUNICIPIO DE MOSSORO;SERVIÇOS;OUTROS;SERVIÇOS - OUTROS;O objeto da presente licitação é a contratação de até 03 (três) Agências de Publicidade e Propaganda, para a prestação de serviços de publicidade, compreendendo o conjunto de atividades realizadas integradamente que tenham por objetivo o estudo, o planejamento, a conceituação, a concepção, a criação, a execução interna, a intermediação e a supervisão da execução externa e a distribuição de publicidade aos veículos e demais meios de divulgação, com o intuito de atender ao direito à informação, de difundir ideias, princípios, iniciativas ou instituições ou de informar o público em geral para atender as necessidades da Prefeitura Municipal de Mossoró, conforme condições, quantidades e exigências estabelecidas neste Edital e seus anexos.;0.0;;REPETIDO
;Dispensa;Natal;CONSELHO REGIONAL DE MEDICINA DO ESTADO DO RN;AQUISIÇÃO;OUTROS;AQUISIÇÃO - OUTROS;contratação de empresa especializada na prestação de Serviço Telefônico Fixo Comutado (STFC), abrangendo chamadas locais, de longa distância nacional (LDN), com ligações ilimitadas, portabilidade dos números atuais e plena compatibilidade com a central telefônica digital IP AVAYA IP500 V2, instalada na sede do CREMERN em Natal/RN. O serviço deverá ser prestado de forma contínua e ininterrupta, com atendimento técnico e suporte às unidades de Natal, Mossoró, Caicó e Pau dos Ferros.;16864.0;;REPETIDO
;Dispensa;Natal;INSTITUTO FEDERAL DE EDUCACAO, CIENCIA E TECNOLOGIA DO RIO GRANDE DO NORTE;SERVIÇOS;OUTROS;SERVIÇOS - OUTROS;Contratação emergencial do serviço de apoio especializado aos estudantes com necessidades educacionais específicas.;11796875.19;;REPETIDO
;Dispensa;São Rafael;MUNICIPIO DE SAO RAFAEL;AQUISIÇÃO;OUTROS;AQUISIÇÃO - OUTROS;Contratação de serviços de arbitragem para atuação em eventos esportivos realizados no Município de São Rafael.;70498.88;;REPETIDO
;Dispensa;Pau dos Ferros;MUNICIPIO DE PAU DOS FERROS;AQUISIÇÃO;OUTROS;AQUISIÇÃO - OUTROS;Processo de despesa destinado a contratação de empresa especializada na prestação de serviço de Seguro de Veículo, para segurar três veículos integrantes da frota da Prefeitura Municipal de Pau dos Ferros/RN, atendendo a Secretaria Municipal de Saúde - SESAU.;12041.89;;REPETIDO
;Dispensa;Natal;COMANDO DA MARINHA;AQUISIÇÃO;OUTROS;AQUISIÇÃO - OUTROS;Contratação de serviço de calibração dos equipamentos da oficina de extintores da Base Naval de Natal (BNN).;1363.0;;REPETIDO
;Dispensa;Natal;COMPANHIA DE DESENV. DO VALE DO SAO FRANCISCO;AQUISIÇÃO;OUTROS;AQUISIÇÃO - OUTROS;Aquisição de ares condicionados, para atender as dependências da 12ª Superintendência Regional da CODEVASF/Natal.;23080.0;;REPETIDO
;Dispensa;Nova Cruz;MUNICIPIO DE NOVA CRUZ;AQUISIÇÃO;OUTROS;AQUISIÇÃO - OUTROS;Contratação de pessoa jurídica, especializada na prestação de serviço de hospedagem, com café da manhã incluso, para atender as necessidades do Município de Nova Cruz/RN.;25500.0;;REPETIDO
;Dispensa;Pau dos Ferros;MUNICIPIO DE PAU DOS FERROS;AQUISIÇÃO;OUTROS;AQUISIÇÃO - OUTROS;Processo de despesa, em caráter emergencial, para atender à necessidade urgente de aquisição de equipamento de mobilidade, sendo: ANDADOR POSTERIOR INFANTIL do paciente Sr. J. M. M. P., para atender demanda da Secretaria Municipal de Saúde – SESAU.;4800.0;;REPETIDO
;Dispensa;Natal;CONSELHO REGIONAL DE MEDICINA DO ESTADO DO RN;AQUISIÇÃO;OUTROS;AQUISIÇÃO - OUTROS;CONTRATAÇÃO DE PESSOA JURÍDICA ESPECIALIZADA EM SERVIÇOS DE SEGURO PREDIAL (SEDE, MEMORIAL E DELEGACIAS DE MOSSORÓ, CAICÓ E PAU DOS FERROS.;3877.51;;REPETIDO
;Dispensa;Mossoró;MUNICIPIO DE MOSSORO;AQUISIÇÃO;OUTROS;AQUISIÇÃO - OUTROS;[Portal de Compras Públicas] - O objeto da presente dispensa é a escolha da proposta mais vantajosa para o fornecimento, instalação e configuração de equipamentos de videomonitoramento (CFTV), incluindo câmeras, NVR, switch PoE, nobreak, racks, réguas de energia e acessórios, destinados à estruturação do sistema de segurança eletrônica da Secretaria Municipal da Fazenda - SEFAZ, conforme condições, quantidades e especificações estabelecidas neste Aviso de Contratação Direta e seus anexos.;24618.53;https://portaldecompraspublicas.com.br/processos/RN/Prefeitura-Municipal-de-Mossoro-1230/DE-02-2025-2026-447910;REPETIDO
;Dispensa;Mossoró;MUNICIPIO DE MOSSORO;AQUISIÇÃO;OUTROS;AQUISIÇÃO - OUTROS;[Portal de Compras Públicas] - O objeto da presente dispensa é a escolha da proposta mais vantajosa para a Aquisição de leitores de códigos de barras e QR Code, destinados a suprir as necessidades operacionais do Setor de Tesouraria vinculado à Secretaria de planejamento, Orçamento e Finanças da Prefeitura Municipal de Mossoró, conforme condições, quantidades e especificações estabelecidas neste Aviso de Contratação Direta e seus anexos.;1530.39;https://portaldecompraspublicas.com.br/processos/RN/Prefeitura-Municipal-de-Mossoro-1230/DE-01-2025-2026-447917;REPETIDO
;Dispensa;Natal;CONSELHO REGIONAL DE MEDICINA DO ESTADO DO RN;AQUISIÇÃO;OUTROS;AQUISIÇÃO - OUTROS;CONTRATAÇÃO DE PESSOA JURÍDICA ESPECIALIZADA EM SERVIÇOS DE SEGURO VEICULAR – JEEP COMPASS 2.0 TD 350 4 X4 AUT. – 5 PASS 2022/2023 PERTENCENTE AO CONSELHO REGIONAL DE MEDICINA DO RN.;3300.0;;REPETIDO
;Dispensa;Natal;UNIVERSIDADE FEDERAL DO RIO GRANDE DO NORTE;AQUISIÇÃO;OUTROS;AQUISIÇÃO - OUTROS;DISPENSA DE LICITAÇÃO Nº.: 90101/2025 - AQUISIÇÃO DE KITS PARA ARDUINO;2890.6;;REPETIDO
;Dispensa;Mossoró;MUNICIPIO DE MOSSORO;AQUISIÇÃO;OUTROS;AQUISIÇÃO - OUTROS;[Portal de Compras Públicas] - Aquisição de itens para tombamento de bens públicos para atender as necessidades do almoxarifado da Prefeitura Municipal de Mossoró, conforme condições, quantidades e especificações estabelecidas neste Aviso de Contratação Direta e seus anexos.;2099.3;https://portaldecompraspublicas.com.br/processos/RN/Prefeitura-Municipal-de-Mossoro-1230/DE-02-2025-2026-447884;REPETIDO
;Dispensa;Equador;MUNICIPIO DE EQUADOR;AQUISIÇÃO;OUTROS;AQUISIÇÃO - OUTROS;Contratação de empresa especializada no fornecimento de água potável mineral ou adicionada de sais, em garrafões de 20 litros, lacrados e selados, isenta de mistura, sujidade, cor e cheiro, pronta para consumo nas secretarias do Município de Equador/RN;60800.0;;REPETIDO
;Dispensa;Nísia Floresta;MUNICIPIO DE NISIA FLORESTA;AQUISIÇÃO;OUTROS;AQUISIÇÃO - OUTROS;Contratação de serviço especializado para a confecção e montagem de estrutura metálica destinada à instalação de elementos de iluminação e decoração natalina no centro da cidade de Nísia Floresta/RN, abrangendo as praças, avenidas principais e áreas de maior circulação pública, de modo a garantir segurança, estabilidade e adequação estética à ornamentação natalina.;9200.0;;REPETIDO
;Dispensa;Equador;MUNICIPIO DE EQUADOR;AQUISIÇÃO;OUTROS;AQUISIÇÃO - OUTROS;[Portal de Compras Públicas] - Contratação de empresa especializada para coleta, gerenciamento, transporte e tratamento de resíduos sólidos perigosos por destruição térmica (incineração) e destinação final das cinzas dos resíduos sólidos provenientes dos serviços de saúde municipal (lixo hospitalar);25480.0;https://portaldecompraspublicas.com.br/processos/RN/Prefeitura-Municipal-de-Equador-2468/DE-2-2026-2026-448088;REPETIDO
;Dispensa;Equador;MUNICIPIO DE EQUADOR;AQUISIÇÃO;OUTROS;AQUISIÇÃO - OUTROS;[Portal de Compras Públicas] - Contratação de empresa especializada para aquisição de extintores de incêndio para diversos ambientes e veículos que estejam em conformidade com as determinações do Inmetro de acordo com as demais informações e descritivos constantes no presente Termo de Referência;13910.95;https://portaldecompraspublicas.com.br/processos/RN/Prefeitura-Municipal-de-Equador-2468/DE-3-2026-2026-448093;REPETIDO
;Dispensa;Japi;MUNICIPIO DE JAPI;AQUISIÇÃO;OUTROS;AQUISIÇÃO - OUTROS;contratação de serviços, de forma parcelada, de elaboração de projetos para corpo de bombeiros, incluindo obtenção de licenças e acompanhamento de vistoria para eventos;41763.12;;REPETIDO
;Dispensa;Jardim de Angicos;JARDIM DE ANGICOS CAMARA MUNICIPAL;AQUISIÇÃO;OUTROS;AQUISIÇÃO - OUTROS;Digitalização centralizada de TODOS os processos de despesa do Exercício de 2025, com tratamento, armazenamento temporário, indexação e classificação de imagens digitalizadas.;18000.0;https://seudominio.com/envio-proposta;REPETIDO
;Dispensa;Paraú;MUNICIPIO DE PARAU;OBRAS;OUTROS;OBRAS - OUTROS;CONTRATAÇÃO EM CARÁTER EMERGENCIAL DE PESSOA JURÍDICA ESPECIALIZADA NA PRESTAÇÃO DE SERVIÇOS DE PROFISSIONAIS DE SAÚDE, COM DISPONIBILIZAÇÃO DE MÃO DE OBRA QUALIFICADA PARA ATUAÇÃO NO HOSPITAL MUNICIPAL ROSALÍA GONDIM E NAS UNIDADES BÁSICAS DE SAÚDE DO MUNICÍPIO DE PARAÚ/RN;2075275.8;;REPETIDO
;Dispensa;Lagoa Nova;CONSORCIO INTERMUNICIPAL DE SANEAMENTO DA SERRA DE SANTANA;AQUISIÇÃO;OUTROS;AQUISIÇÃO - OUTROS;[Portal de Compras Públicas] - Contratação de empresa para fornecimento de combustíveis (gasolina comum) para atender as necessidades do CONISA.;60000.0;https://portaldecompraspublicas.com.br/processos/RN/Consorcio-Intermunicipal-de-Saneamento-da-Serra-de-Santana-CONISA-1118/DEMD-001-2026-2026-448196;REPETIDO
;Dispensa;Lagoa Nova;CONSORCIO INTERMUNICIPAL DE SANEAMENTO DA SERRA DE SANTANA;AQUISIÇÃO;OUTROS;AQUISIÇÃO - OUTROS;[Portal de Compras Públicas] - Contratação de Empresa para Locação de Impressora, para atender as necessidades do CONISA.;8579.88;https://portaldecompraspublicas.com.br/processos/RN/Consorcio-Intermunicipal-de-Saneamento-da-Serra-de-Santana-CONISA-1118/DE-002-2026-2026-448197;REPETIDO
;Dispensa;Carnaúba dos Dantas;MUNICIPIO DE CARNAUBA DOS DANTAS;AQUISIÇÃO;OUTROS;AQUISIÇÃO - OUTROS;CONTRATAÇÃO DE EMPRESA ESPECIALIZADA NO FORNECIMENTO DE PORTÃO DE MATERIAL GALVANIZADO PARA ARENINHA POTIGUAR – MÁRCIO JOSÉ DE OLIVEIRA DANTAS;3591.13;https://transparencia.agilirn.com.br/prefcarnaubadantas-rn/licitacoes/licitacao?id=1460;REPETIDO
;Dispensa;Carnaúba dos Dantas;MUNICIPIO DE CARNAUBA DOS DANTAS;SERVIÇOS;OUTROS;SERVIÇOS - OUTROS;CONTRATAÇÃO, POR DISPENSA DE LICITAÇÃO, DE EMPRESA ESPECIALIZADA NA PRESTAÇÃO DE SERVIÇOS TÉCNICOS DE CONSULTORIA NA ÁREA DA SAÚDE, COM FOCO NO ACOMPANHAMENTO TÉCNICO E ADMINISTRATIVO DE EMENDAS PARLAMENTARES DESTINADAS À SAÚDE;33087.48;https://transparencia.agilirn.com.br/prefcarnaubadantas-rn/licitacoes/licitacao?id=1461;REPETIDO
;Dispensa;Lagoa Nova;MUNICIPIO DE LAGOA NOVA;AQUISIÇÃO;OUTROS;AQUISIÇÃO - OUTROS;Celebração de Termo de Colaboração com a Associação Casa do Divino Mestre – ACDM, para a execução do serviço de acolhimento institucional provisório, incluindo hospedagem, alimentação e suporte logístico a pacientes do Município de Lagoa Nova/RN e seus acompanhantes durante o Tratamento Fora de Domicílio (TFD) na cidade de Natal/RN, com fundamento na Lei nº 13.019/2014 (Marco Regulatório das Organizações da Sociedade Civil – MROSC), mediante dispensa de chamamento público nos termos do art. 30, VI, da referida lei.;84000.0;;REPETIDO
;Dispensa;Touros;TOUROS CAMARA MUNICIPAL;AQUISIÇÃO;OUTROS;AQUISIÇÃO - OUTROS;Valor emprenhado, referente a continuação do contrato de serviço de prestação de serviços de gestão digital por meio da digitalização, processo nº 021200003.;14400.0;https://seudominio.com/envio-proposta;REPETIDO
;Dispensa;Touros;TOUROS CAMARA MUNICIPAL;AQUISIÇÃO;OUTROS;AQUISIÇÃO - OUTROS;Contratação de empresa especializada no segmento de tecnologia da informação para a prestação de serviços de implantação de Sistema Informatizado de Aplicativo de Votação Eletrônica e aplicativo mobile da entidade Câmara Municipal de Touros, contemplando Treinamento, Suporte Técnico e Licença de Uso durante a vigência do contrato, conforme itens descritos neste termo.;35000.0;https://seudominio.com/envio-proposta;REPETIDO
;Dispensa;Macau;MUNICIPIO DE MACAU;AQUISIÇÃO;OUTROS;AQUISIÇÃO - OUTROS;Contratação de empresa Especializada no Fornecimento de Alimentação Pronta (Café da Manhã, Almoço, Janta, Buffet E Coffebreak), Para Atender as Necessidades das Secretarias Municipais da Prefeitura Municipal de Macau/RN.;62657.0;;REPETIDO
;Dispensa;Pau dos Ferros;MUNICIPIO DE PAU DOS FERROS;AQUISIÇÃO;OUTROS;AQUISIÇÃO - OUTROS;Processo de despesa destinado a contratação de empresa especializada na prestação de serviço de Seguro de Veículo, para segurar o veículo – CHEVROLET – SPIN PREMIER 1.8 – 0KM, PLACA TSV7G98 - integrante da frota da Prefeitura Municipal de Pau dos Ferros/RN, atendendo a Secretaria Municipal de Saúde - SESAU.;4163.77;;REPETIDO
;Dispensa;Pau dos Ferros;MUNICIPIO DE PAU DOS FERROS;OBRAS;OUTROS;OBRAS - OUTROS;Processo destinado a contratação de empresa especializada no fornecimento de Obras Literárias de autores locais destinados à ampliação do acervo literário das unidades de ensino da rede municipal, para atender demanda da Secretaria Municipal de Educação – SEDUC.;15515.0;;REPETIDO
;Dispensa;Pau dos Ferros;MUNICIPIO DE PAU DOS FERROS;AQUISIÇÃO;OUTROS;AQUISIÇÃO - OUTROS;Processo de despesa destinado a contratação de empresa especializada na prestação de serviços de 1ª revisão programada – 10.000 KM (dez mil quilômetros), incluindo o fornecimento de peças e acessórios para veículo PAJERO SPORT HPE-S 2.4 DI-D 4X4 AT, 2024/2025, PLACA - TSS4J46 - veículo da frota da Administração Pública de Pau dos Ferros/RN para atender demandas da Secretaria de Governo - SEGOV.;2234.57;;REPETIDO
;Dispensa;Macau;MUNICIPIO DE MACAU;AQUISIÇÃO;OUTROS;AQUISIÇÃO - OUTROS;Aquisição de peças para diversos equipamentos necessários na manutenção corretiva de equipamentos hospitalares diversos, visando atender de forma emergencial e satisfatória as necessidades do Hospital Antônio Ferraz no município de Macau/RN.;41988.0;;REPETIDO
;Dispensa;Bento Fernandes;MUNICIPIO DE BENTO FERNANDES;AQUISIÇÃO;OUTROS;AQUISIÇÃO - OUTROS;Aquisição parcelada de água mineral natural, acondicionada em garrafões retornáveis de 20 (vinte) litros, destinada ao atendimento das necessidades das diversas Secretarias e órgãos da Prefeitura Municipal de Bento Fernandes/RN;53060.0;;REPETIDO
